{
  "schema_version": "compatibility-product-status-v1",
  "identity": {
    "upstream_sha": "d13cc61c00a64725a838465058e0ace18f51a7f1",
    "engine_sha": "253cf7a242bc6ce8a0f65cd75a42731bd2ef893a",
    "freqtrade_digest": "sha256:d47d7053dc07eca2ace20385575143090ba88621007e5e8b76052dca6038799a",
    "semantic_profile_sha256": "b234eeab6a417cf03e02ce65f9cdf219ff6429f614dfcfc07ef39c6be9cac596",
    "strategy_sha256": "a7187e5e5c33c95a936629909fe25eedbf74a9cc2dccb83ac906ad05c5edcc10"
  },
  "observed_identity": {
    "engine_sha": "253cf7a242bc6ce8a0f65cd75a42731bd2ef893a",
    "upstream_sha": "63d886c857b0ae4748c5418b342080dca05284e3"
  },
  "workflow": {
    "state": "succeeded"
  },
  "product": {
    "state": "inconclusive",
    "reason": "stale_upstream"
  },
  "discovery_execution": {
    "spot": "not_required",
    "futures": "not_required"
  },
  "same_engine_proof": {
    "complete": false,
    "engine_sha": "253cf7a242bc6ce8a0f65cd75a42731bd2ef893a",
    "source_run_id": null,
    "manifest_sha256": null,
    "artifact_sha256": {}
  },
  "required_status_passed": false,
  "fingerprint": "2d566203edff07a639e4b92f649a4347adc3f6a71bb108b51ca9cced57d70420"
}
